{
  "schema_version": "1.0.0",
  "protocol_version": "data01b-v0.1",
  "source_revision": "083a2bf606714a616e0dc5e5dd46f4081bedcaa1",
  "sampling_frame": {
    "start_utc": "2026-07-17T00:00:00Z",
    "end_utc": "2026-07-18T00:00:00Z",
    "selection_rule": "all_eligible_runs",
    "excluded_run_ids": []
  },
  "records": [
    {
      "run_id": "2026-07-17T1904Z-stack01-integration-map",
      "evidence_path": "logs/research/2026-07-17/1904-stack01-canonical-integration-map.md",
      "assignment_outcome": "completed",
      "selection_path": "highest_priority_ready",
      "human_intervention": "none_recorded",
      "validation_outcome": "not_reconstructable",
      "evidence_completeness": "partial",
      "missing_fields": ["tool_calls", "human_minutes", "ci_run"],
      "coder": "agent_primary",
      "coding_status": "single_coded"
    }
  ]
}
